{"type": "session_init", "domain": "custom", "started": "2026-08-26T22:41:10.398485+00:00", "runs": 15, "best_score": 100, "consecutive_reverts": 0, "failed_strategies": ["baseline", "visual-expansion", "add-neon-collaboration", "embed-ai-chat", "add-vendor-outreach", "generalize-category", "multi-buyer-collaboration"]}
{"run": 1, "timestamp": "2026-08-26T22:41:48.970318+00:00", "domain": "custom", "mutation_strategy": "baseline", "score": 82, "dimensions": {"challenge_alignment": 22, "product_demo_clarity": 21, "execution_reliability": 18, "trust_evidence_depth": 21}, "status": "baseline", "variant_summary": "Clear buyer-room thesis and human-agent workflow, but the scope is too broad and write controls are under-specified.", "content": ""}
{"run": 2, "timestamp": "2026-08-26T22:42:08.411797+00:00", "domain": "custom", "mutation_strategy": "scope-compression", "score": 88, "dimensions": {"challenge_alignment": 23, "product_demo_clarity": 23, "execution_reliability": 21, "trust_evidence_depth": 21}, "status": "kept", "variant_summary": "Compressed the app to one fictional buyer, six requirements, three surfaces, nine tools, and a canonical demo. Brand gate: pass. Evidence gate: ready.", "content": ""}
{"run": 3, "timestamp": "2026-08-26T22:42:37.690644+00:00", "domain": "custom", "mutation_strategy": "demo-first-architecture", "score": 91, "dimensions": {"challenge_alignment": 24, "product_demo_clarity": 24, "execution_reliability": 22, "trust_evidence_depth": 21}, "status": "kept", "variant_summary": "Bound the stack, state model, shared domain actions, deterministic fixtures, Cloudflare deployment, and four verification layers to the canonical demo. Brand gate: pass. Evidence gate: ready.", "content": ""}
{"run": 4, "timestamp": "2026-08-26T22:42:50.950027+00:00", "domain": "custom", "mutation_strategy": "visual-expansion", "score": 85, "dimensions": {"challenge_alignment": 23, "product_demo_clarity": 22, "execution_reliability": 19, "trust_evidence_depth": 21}, "status": "reverted", "variant_summary": "More screens and personas improved visual breadth but weakened the demo spine and raised implementation risk. Rejected.", "content": ""}
{"run": 5, "timestamp": "2026-08-26T22:43:47.166546+00:00", "domain": "custom", "mutation_strategy": "trust-contract-and-evals", "score": 94, "dimensions": {"challenge_alignment": 24, "product_demo_clarity": 24, "execution_reliability": 23, "trust_evidence_depth": 23}, "status": "kept", "variant_summary": "Added enforced proposal integrity, evidence eligibility, deterministic requirement rules, genuine activity events, security boundaries, a twelve-case eval suite, and a distinctive visual direction. Brand gate: pass. Evidence gate: ready.", "content": ""}
{"run": 6, "timestamp": "2026-08-26T22:44:17.839042+00:00", "domain": "custom", "mutation_strategy": "add-neon-collaboration", "score": 89, "dimensions": {"challenge_alignment": 23, "product_demo_clarity": 22, "execution_reliability": 20, "trust_evidence_depth": 24}, "status": "reverted", "variant_summary": "Shareable rooms add identity, permissions, schema, privacy, and network failure modes without improving the canonical single-session demo.", "content": ""}
{"run": 7, "timestamp": "2026-08-26T22:44:17.917105+00:00", "domain": "custom", "mutation_strategy": "embed-ai-chat", "score": 84, "dimensions": {"challenge_alignment": 20, "product_demo_clarity": 22, "execution_reliability": 20, "trust_evidence_depth": 22}, "status": "reverted", "variant_summary": "An embedded model duplicates the browser agent, adds credentials and network risk, and makes WebMCP less central.", "content": ""}
{"run": 8, "timestamp": "2026-08-26T22:44:17.998053+00:00", "domain": "custom", "mutation_strategy": "add-vendor-outreach", "score": 85, "dimensions": {"challenge_alignment": 22, "product_demo_clarity": 21, "execution_reliability": 18, "trust_evidence_depth": 24}, "status": "reverted", "variant_summary": "Sending vendor requests introduces consequential external effects and integrations. A visible unsent draft preserves the value safely.", "content": ""}
{"run": 9, "timestamp": "2026-08-26T22:44:18.083528+00:00", "domain": "custom", "mutation_strategy": "generalize-category", "score": 90, "dimensions": {"challenge_alignment": 23, "product_demo_clarity": 22, "execution_reliability": 22, "trust_evidence_depth": 23}, "status": "reverted", "variant_summary": "A general evidence schema is reusable but weakens the specific buyer story and adds ingestion scope. It does not beat the 94-point best.", "content": ""}
{"run": 10, "timestamp": "2026-08-26T22:44:18.174102+00:00", "domain": "custom", "mutation_strategy": "multi-buyer-collaboration", "score": 92, "dimensions": {"challenge_alignment": 24, "product_demo_clarity": 23, "execution_reliability": 21, "trust_evidence_depth": 24}, "status": "reverted", "variant_summary": "Real-time stakeholder collaboration has product value but requires identity, permissions, conflict handling, and backend state. It does not beat the 94-point best.", "content": ""}
{"run": 11, "timestamp": "2026-08-29T22:04:28.477194+00:00", "domain": "custom", "mutation_strategy": "judge-runway-and-agent-rehearsal", "score": 98, "dimensions": {"challenge_alignment": 24, "product_demo_clarity": 24, "execution_reliability": 25, "trust_evidence_technical_depth": 25}, "status": "kept", "variant_summary": "Added an immediate buyer requirements to evidence to human decision chain, a safe browser-agent rehearsal path, and truthful live-agent documentation. Brand gate passed. Full local QA passed with live natural-language selection still marked not_run.", "content": "Work order 013. Independent contract audit found no product regressions. Independent visual audit recommended keep. Codex QA passed lint, typecheck, 438 tests, build, bundle budget, 45 end-to-end tests, 52 accessibility checks, 12 deterministic evals, valid not_run live-agent record, and git diff check."}
{"run": 12, "timestamp": "2026-08-29T22:19:10.452270+00:00", "domain": "custom", "mutation_strategy": "agent-input-provenance", "score": 99, "dimensions": {"challenge_alignment": 25, "product_demo_clarity": 24, "execution_reliability": 25, "trust_evidence_technical_depth": 25}, "status": "kept", "variant_summary": "Closed the prompt-to-schema gap by returning a page-owned fictional staging template, sourcing proposal arguments from the preceding WebMCP read, and adding adversarial regression proof against fixture reintroduction. Full independent local QA passed; live natural-language selection remains not_run.", "content": "Work orders 014 and 014a. Independent contract audit recommended keep. Adversarial audit exposed an identical-fixture provenance weakness, then the follow-up added transformed-template, strict added-field, strict missing-field, and adjacency tests. Codex QA passed lint, typecheck, 447 tests, build, bundle budget, 45 end-to-end tests, 52 accessibility checks, 12 deterministic evals, valid not_run live-agent record, byte-identical visual artifacts, and git diff check."}
{"run": 13, "timestamp": "2026-08-29T22:24:39.589548+00:00", "domain": "custom", "mutation_strategy": "submission-state-truth", "score": 99, "dimensions": {"challenge_alignment": 24, "product_demo_clarity": 25, "execution_reliability": 25, "trust_evidence_technical_depth": 25}, "status": "kept", "variant_summary": "Separated verified public baseline, current local candidate, empty Devpost pre-draft shell, and future external actions across the launch package. Corrected the demo timing evidence against the exact final spoken text after an audit caught a three-word drift.", "content": "Work orders 015 and 015a. Cursor passed lint, typecheck, 447 tests, build, bundle budget, 12 deterministic evals, valid not_run live-agent record, and git diff check. Codex independently found the reported 271 words were actually 274 after a final wording change; follow-up restored an exact 271-word script and measured the final text at 133.183991 seconds, leaving 31.816009 seconds to the 2:45 target."}
{"run": 14, "timestamp": "2026-08-29T22:36:55Z", "domain": "custom", "mutation_strategy": "judge-facing-demo-gallery", "score": 99, "dimensions": {"challenge_alignment": 25, "product_demo_clarity": 25, "execution_reliability": 25, "trust_evidence_technical_depth": 24}, "status": "kept", "variant_summary": "Built a coherent landing-to-evidence-to-human-approval gallery, corrected receipt occlusion, recorded one deterministic registered WebMCP read beside person actions, and separated local rehearsal from future verified public recording. Full independent QA passed; live natural-language selection remains not_run.", "content": "Work orders 016 and 016a. The first pass was revised after audits found a sticky-guide collision and a public-versus-local recording mismatch. The corrected 1600 by 900 gallery preserves images 01 and 02, shows the complete decision receipt with Agent 1 and Person 13 in the shared activity summary, and labels the shim read as scripted local proof. Codex QA passed lint, typecheck, 447 tests, build, bundle budget, 45 end-to-end tests, 52 accessibility checks, 12 deterministic evals, valid not_run live-agent record, byte-identical gallery artifacts during ordinary QA, and git diff check."}
{"run": 15, "timestamp": "2026-08-31T16:18:43.216365+00:00", "domain": "custom", "mutation_strategy": "responses-api-model-selection-eval", "score": 100, "dimensions": {"challenge_alignment": 25, "product_demo_clarity": 25, "execution_reliability": 25, "trust_evidence_technical_depth": 25}, "status": "kept", "variant_summary": "Added a hardened OpenAI Responses model-selection lane over the exact nine production schemas and shared actions. An authorized gpt-5.6 run passed all seven cases at 100 after evaluator hardening. Evidence remains explicitly local and does not claim native WebMCP discovery or compatible browser-agent proof.", "content": "Work orders 018 through 018k. Cursor implemented; Codex and independent audits hardened contract binding, artifact bounds, snapshot freshness, EU truth classification, brand-safe persistence, and evidence-preserving tests. A live failure on ambiguous per-turn wording led to a protocol-neutral continuation guard now bound into the contract digest. The current authorized artifact validates 7/7 at 100 with exact nine tools, the two judge-visible approval gates still person-only, EU unknown, and compatible browser-agent evidence still not_run. Local verification passed lint, typecheck, 447 product tests, 72 evaluator tests, 12 deterministic cases, valid live-agent not_run evidence, build, bundle budgets, and artifact integrity checks."}
{"run": 16, "timestamp": "2026-08-31T17:13:35Z", "domain": "custom", "mutation_strategy": "release-candidate-parity-gate", "score": 100, "dimensions": {"challenge_alignment": 25, "product_demo_clarity": 25, "execution_reliability": 25, "trust_evidence_technical_depth": 25}, "status": "kept", "variant_summary": "Added a fail-closed release-candidate gate that keeps local QA, public deployment, native WebMCP, Responses API, compatible browser-agent, deterministic, and product-invariant evidence distinct. Independent adversarial loops closed digest-binding, path-containment, schema-parity, invalid-eval, and receipt-readback gaps. The honest candidate remains blocked until external lifecycle evidence is refreshed.", "content": "Work orders 019 through 019c. Cursor implemented and Codex ran three independent audit cycles, rejecting two intermediate candidates before acceptance. The final gate binds release receipts to exact bytes, reads referenced evidence through contained descriptors, enforces the exact nine tools, seven human-only actions, two judge-visible approvals, and EU unknown, and validates shared malicious fixtures with strict Zod and checked-in Ajv contracts. The final local QA receipt passed all 11 stages, 483 product tests, 45 end-to-end journeys, 52 accessibility checks, 12 deterministic cases, Responses 7/7 at 100, valid compatible-browser not_run evidence, build, bundle budgets, byte-identical visual artifacts, and git diff check. The refreshed RC receipt is honestly blocked only by a dirty worktree, stale public release, stale native WebMCP evidence, and compatible browser-agent evidence not run."}
